name,full_address,city,state,postal_code,phone,site,latitude,longitude,rating,reviews,working_hours,place_id,type,subtypes,category,description,source_keyword
Bubby’s New York Diner,"3025 Bathurst St, North York, ON M6B 3B6",North York,Ontario,M6B 3B6,+1 416-862-2435,http://www.bubbysbagels.com/,43.718146399999995,-79.4291566,4.3,115,"{'Friday': ['9:30a.m.-12:30p.m.'], 'Monday': ['11:30a.m.-10p.m.'], 'Saturday': ['Closed'], 'Sunday': ['11:30a.m.-10p.m.'], 'Thursday': ['11:30a.m.-12a.m.'], 'Tuesday': ['11:30a.m.-10p.m.'], 'Wednesday': ['11:30a.m.-10p.m.']}",ChIJmSfUc-AzK4gRJTHzX1jw1NY,Kosher restaurant,"Kosher restaurant, Chicken wings restaurant, Hamburger restaurant, Meat dish restaurant",restaurants,,kosher catering large groups Toronto
Haymishe Bakery,"3031 Bathurst St, Toronto, ON M6B 3B5",Toronto,Ontario,M6B 3B5,+1 416-781-4212,http://haymishebakery.com/,43.718252799999995,-79.42920769999999,4.4,164,"{'Friday': ['6a.m.-2:30p.m.'], 'Monday': ['7a.m.-7p.m.'], 'Saturday': ['6:30-11:30p.m.'], 'Sunday': ['7a.m.-7p.m.'], 'Thursday': ['7a.m.-7p.m.'], 'Tuesday': ['7a.m.-7p.m.'], 'Wednesday': ['7a.m.-7p.m.']}",ChIJY9MnEqszK4gRHbOEjsBFHuo,Kosher restaurant,"Kosher restaurant, Cake shop, Bakery, Pastry shop",Bakery,,kosher catering large groups Toronto
Dave's Genuine Deli,"1763 Avenue Rd, Toronto, ON M5M 3Y8",Toronto,Ontario,M5M 3Y8,+1 416-787-3354,http://www.davesgenuine.ca/,43.7294136,-79.4183121,4.5,369,"{'Friday': ['10a.m.-8p.m.'], 'Monday': ['10a.m.-8p.m.'], 'Saturday': ['10a.m.-8p.m.'], 'Sunday': ['10a.m.-8p.m.'], 'Thursday': ['10a.m.-8p.m.'], 'Tuesday': ['10a.m.-8p.m.'], 'Wednesday': ['10a.m.-8p.m.']}",ChIJO30KurYvK4gRVyRPm5odnlA,Bar,"Bar, Restaurant, Catering food and drink supplier, Deli, Jewish restaurant, Takeout Restaurant",restaurants,,kosher catering large groups Toronto
The Chicken Nest,"3038 Bathurst St, North York, ON M6B 4K1",North York,Ontario,M6B 4K1,+1 416-787-6378,http://thechickennest.ca/,43.7185493,-79.42988009999999,4.4,378,"{'Friday': ['Closed'], 'Monday': ['11:30a.m.-10:45p.m.'], 'Saturday': ['Closed'], 'Sunday': ['1-10:45p.m.'], 'Thursday': ['11:30a.m.-10:45p.m.'], 'Tuesday': ['11:30a.m.-10:45p.m.'], 'Wednesday': ['11:30a.m.-10:45p.m.']}",ChIJFeeEa6szK4gROM20N9_47zs,Kosher restaurant,"Kosher restaurant, Chicken restaurant, Hamburger restaurant, Sandwich shop, Steak house",restaurants,"Casual, no-frills provider of kosher poultry & rib dishes, plus light American fare like salads.",kosher platters delivery Toronto
Bay St Deli Kosher,"40 Bay St., Toronto, ON M5J 2X8",Toronto,Ontario,M5J 2X8,,,43.6437007,-79.3784421,4.3,10,None,ChIJ20v2wFLL1IkRl3TybI1tHxA,Kosher restaurant,Kosher restaurant,restaurants,,kosher platters delivery Toronto
Dr. Laffa Restaurant,"3027 Bathurst St, North York, ON M6B 3B5",North York,Ontario,M6B 3B5,+1 647-352-9000,http://drlaffa.com/,43.729291499999995,-79.4318231,3.9,927,"{'Friday': ['11a.m.-2p.m.'], 'Monday': ['11a.m.-9p.m.'], 'Saturday': ['Closed'], 'Sunday': ['11a.m.-9p.m.'], 'Thursday': ['11a.m.-9p.m.'], 'Tuesday': ['11a.m.-9p.m.'], 'Wednesday': ['11a.m.-9p.m.']}",ChIJIbVz-XQuK4gRdgGCva8ZrH8,Kosher restaurant,"Kosher restaurant, Middle Eastern restaurant, Mediterranean restaurant",restaurants,"Unassuming kosher counter-serve spot serving falafel, shawarma & other Middle Eastern favourites.",kosher platters delivery Toronto
Yours Truly Meat Co.,"3500 Bathurst St, North York, ON M6A 2C6",CA,Ontario,M6A 2C6,+1 416-663-7779,http://yourstrulymeat.com/,43.7290023,-79.43243799999999,4.9,16,"{'Friday': ['7a.m.-2p.m.'], 'Monday': ['8a.m.-7p.m.'], 'Saturday': ['Closed'], 'Sunday': ['9a.m.-6p.m.'], 'Thursday': ['8a.m.-8p.m.'], 'Tuesday': ['8a.m.-7p.m.'], 'Wednesday': ['8a.m.-7p.m.']}",ChIJRQHELl0zK4gRS3ZB6clqgkI,Meat processor,"Meat processor, Butcher shop, Deli Shop, Food producer",Meat processor,,kosher platters delivery Toronto
Pancer's Original Deli,"3856 Bathurst St, North York, ON M3H 3N3",CA,Ontario,M3H 3N3,+1 416-636-1230,http://www.pancersoriginaldeli.com/,43.7407951,-79.43537839999999,4.6,1612,"{'Friday': ['10a.m.-7:20p.m.'], 'Monday': ['10a.m.-7:20p.m.'], 'Saturday': ['10a.m.-7:20p.m.'], 'Sunday': ['10a.m.-7:20p.m.'], 'Thursday': ['10a.m.-7:20p.m.'], 'Tuesday': ['10a.m.-7:20p.m.'], 'Wednesday': ['10a.m.-7:20p.m.']}",ChIJIckrvGcyK4gRJ2lNTEcu0M4,Deli,"Deli, Canadian restaurant, Deli Shop, Family restaurant, Jewish restaurant",Deli,"Long-running, bare-bones spot known for its pastrami sandwiches & Jewish deli staples.",kosher platters delivery Toronto
Romi's,"744 St Clair Ave W, York, ON M6C 1B5",CA,Ontario,M6C 1B5,+1 416-656-1525,http://romisbakery.com/,43.6814077,-79.42790529999999,4.5,826,"{'Friday': ['9a.m.-9:30p.m.'], 'Monday': ['9a.m.-9:30p.m.'], 'Saturday': ['9a.m.-10p.m.'], 'Sunday': ['9a.m.-9:30p.m.'], 'Thursday': ['9a.m.-9:30p.m.'], 'Tuesday': ['9a.m.-9:30p.m.'], 'Wednesday': ['9a.m.-9:30p.m.']}",ChIJnR7PixA1K4gRIXggE8MbVls,Israeli restaurant,Israeli restaurant,restaurants,,kosher platters delivery Toronto
Protein Chefs - Toronto Healthy Meal Delivery,"123 Edward St suite 200 v2, Toronto, ON M5G 0A8",Toronto,Ontario,M5G 0A8,+1 833-585-1613,https://proteinchefs.com/pages/north-york-healthy-meal-delivery-company/,43.6556211,-79.3867882,4.7,119,"{'Friday': ['9a.m.-5p.m.'], 'Monday': ['9a.m.-5p.m.'], 'Saturday': ['9a.m.-5p.m.'], 'Sunday': ['9a.m.-5p.m.'], 'Thursday': ['9a.m.-5p.m.'], 'Tuesday': ['9a.m.-5p.m.'], 'Wednesday': ['9a.m.-5p.m.']}",ChIJEbBtI8o1K4gRFd1HvStGy1E,Delivery Restaurant,"Delivery Restaurant, Catering food and drink supplier, Caterer, Food manufacturer, Food producer, Takeout Restaurant",Meal delivery,,kosher meal delivery same day Toronto
Slice N Bites,"3020 Bathurst St, North York, ON M6B 3B6",North York,Ontario,M6B 3B6,+1 416-781-1326,http://www.slicenbites.com/,43.7179387,-79.42972999999999,4.5,453,"{'Friday': ['10:30a.m.-2:30p.m.'], 'Monday': ['10:30a.m.-6:30p.m.'], 'Saturday': ['6:30p.m.-12a.m.'], 'Sunday': ['10:30a.m.-7:30p.m.'], 'Thursday': ['10:30a.m.-7:30p.m.'], 'Tuesday': ['10:30a.m.-6:30p.m.'], 'Wednesday': ['10:30a.m.-6:30p.m.']}",ChIJo59ac6szK4gRK3B50LwisUA,Pizza restaurant,"Pizza restaurant, Falafel restaurant, Kosher restaurant, Pizza delivery, Sandwich shop, Soup restaurant, Sushi restaurant",restaurants,Kosher fare ranging from sushi rolls to pizza offered in a down-to-earth setting.,kosher meal delivery same day Toronto
Pizza Cafe,"3774 Bathurst St, North York, ON M3H 3M6",North York,Ontario,M3H 3M6,+1 416-633-5678,http://www.pizzacafe.ca/,43.737949799999996,-79.43467609999999,4.5,341,"{'Friday': ['10a.m.-6:30p.m.'], 'Monday': ['10a.m.-9p.m.'], 'Saturday': ['6:30p.m.-12a.m.'], 'Sunday': ['10a.m.-9p.m.'], 'Thursday': ['10a.m.-9p.m.'], 'Tuesday': ['10a.m.-9p.m.'], 'Wednesday': ['10a.m.-9p.m.']}",ChIJX0v_C10yK4gRXspoAXxW5Us,Kosher restaurant,"Kosher restaurant, Pizza restaurant",restaurants,"Offering kosher food, this strip-mall pizzeria dishes out traditional pies, sandwiches & pasta.",kosher meal delivery same day Toronto
Cut The Prep Meal Prep,"5 Mariner Terrace Suite 2911, Toronto, ON M5V 3V6",Toronto,Ontario,M5V 3V6,+1 437-990-1779,,43.6397355,-79.3904175,5.0,6,"{'Friday': ['Open 24 hours'], 'Monday': ['Open 24 hours'], 'Saturday': ['Open 24 hours'], 'Sunday': ['Open 24 hours'], 'Thursday': ['Open 24 hours'], 'Tuesday': ['Open 24 hours'], 'Wednesday': ['Open 24 hours']}",ChIJ7TjIMYbL1IkRIWyguxmgFv8,Catering food and drink supplier,"Catering food and drink supplier, Food producer, Consultant",Food producer,,kosher meal delivery same day Toronto
Richmond Kosher Bakery,"4119 Bathurst St Unit 1, North York, ON M3H 3P4",North York,Ontario,M3H 3P4,+1 647-776-5995,http://richmondkosherbakery.com/,43.747001999999995,-79.4360397,4.4,201,"{'Friday': ['6a.m.-4p.m.'], 'Monday': ['6a.m.-7p.m.'], 'Saturday': ['Closed'], 'Sunday': ['7a.m.-6p.m.'], 'Thursday': ['6a.m.-7p.m.'], 'Tuesday': ['6a.m.-7p.m.'], 'Wednesday': ['6a.m.-7p.m.']}",ChIJY-3_gWUyK4gRo3mGdlc0tRI,Bakery,"Bakery, Kosher grocery store",Bakery,,kosher meal delivery same day Toronto
Gatsby,"18 St Thomas St, Toronto, ON M5S 3E7",Toronto,Ontario,M5S 3E7,+1 416-971-9666,http://www.windsorarmshotel.com/dining/livingroom/,43.6687989,-79.39134609999999,3.3,76,"{'Friday': ['11a.m.-11p.m.'], 'Monday': ['11a.m.-11p.m.'], 'Saturday': ['11a.m.-11p.m.'], 'Sunday': ['11a.m.-11p.m.'], 'Thursday': ['11a.m.-11p.m.'], 'Tuesday': ['11a.m.-11p.m.'], 'Wednesday': ['11a.m.-11p.m.']}",ChIJjz8TAbA0K4gRiogJUu9i5-k,Kosher restaurant,"Kosher restaurant, Restaurant, Modern British restaurant",restaurants,"Cozy, chic locale at the Windsor Arms hotel offering upscale Canadian fare & 60 local craft drafts.",kosher meal delivery same day Toronto
Zelden's Deli and Desserts,"1446 Yonge St, Toronto, ON M4T 1Y5",Toronto,Ontario,M4T 1Y5,+1 647-347-3474,http://www.zeldensdelianddesserts.com/,43.6874617,-79.3939774,4.5,443,"{'Friday': ['8a.m.-9p.m.'], 'Monday': ['8a.m.-9p.m.'], 'Saturday': ['9a.m.-9p.m.'], 'Sunday': ['9a.m.-9p.m.'], 'Thursday': ['8a.m.-9p.m.'], 'Tuesday': ['8a.m.-9p.m.'], 'Wednesday': ['8a.m.-9p.m.']}",ChIJlUsD3FozK4gR-leQdjky9Cc,Restaurant,Restaurant,restaurants,,kosher meal delivery same day Toronto
Essen on Bathurst,"3023 Bathurst St, North York, ON M6B 3B5",North York,Ontario,M6B 3B5,+1 416-256-7377,https://www.essenonbathurst.ca/,43.718101399999995,-79.4292076,4.6,9,"{'Friday': ['9a.m.-2p.m.'], 'Monday': ['11:30a.m.-9p.m.'], 'Saturday': ['Closed'], 'Sunday': ['11:30a.m.-9p.m.'], 'Thursday': ['11:30a.m.-12a.m.'], 'Tuesday': ['11:30a.m.-9p.m.'], 'Wednesday': ['11:30a.m.-9p.m.']}",ChIJ35NuWbIzK4gRGXezOB2y4WQ,Takeout Restaurant,Takeout Restaurant,restaurants,,kosher comfort food delivery Toronto
Fat Pasha,"414 Dupont St, Toronto, ON M5R 1V9",Toronto,Ontario,M5R 1V9,+1 647-646-1698,http://www.fatpasha.com/,43.6738449,-79.4117562,4.3,1566,"{'Friday': ['5-11p.m.'], 'Monday': ['5-10p.m.'], 'Saturday': ['11a.m.-2:45p.m.', '5-10p.m.'], 'Sunday': ['11a.m.-2:45p.m.', '5-10p.m.'], 'Thursday': ['5-10p.m.'], 'Tuesday': ['5-10p.m.'], 'Wednesday': ['5-10p.m.']}",ChIJRzxXBJs0K4gRGlDJ5_mt5NA,Middle Eastern restaurant,"Middle Eastern restaurant, Bar, Israeli restaurant, Jewish restaurant",restaurants,Funky eatery with country-chic decor serving Middle Eastern & European Jewish dishes.,kosher comfort food delivery Toronto
A Yiddishe Mame,"1416 Centre St, Thornhill, ON L4J 8A1",Thornhill,Ontario,L4J 8A1,+1 905-597-7709,https://ayiddishemame.ca/,43.807188,-79.4719901,4.6,264,"{'Friday': ['12-8p.m.'], 'Monday': ['12-8p.m.'], 'Saturday': ['12-8p.m.'], 'Sunday': ['12-8p.m.'], 'Thursday': ['12-8p.m.'], 'Tuesday': ['12-8p.m.'], 'Wednesday': ['12-8p.m.']}",ChIJYR3HYYIuK4gRBngsxKC_AiQ,Jewish restaurant,Jewish restaurant,restaurants,,kosher comfort food delivery Toronto
Electric Love Bakeshop,"900 Wilson Ave, North York, ON M3K 1E7",CA,Ontario,M3K 1E7,+1 647-989-5274,http://www.electriclovebakeshop.com/,43.7304124,-79.469171,4.9,108,"{'Friday': ['8:30a.m.-2:30p.m.'], 'Monday': ['9a.m.-3p.m.'], 'Saturday': ['Closed'], 'Sunday': ['9a.m.-3p.m.'], 'Thursday': ['9a.m.-3p.m.'], 'Tuesday': ['9a.m.-3p.m.'], 'Wednesday': ['9a.m.-3p.m.']}",ChIJRT-T_a0zK4gRoaWIDTi522w,Bakery,Bakery,Bakery,,kosher caterer North York
Goldie's - Restaurant & Caterer - An Eisenbergs Company,"4580 Dufferin St, North York, ON M3H 5Y2",North York,Ontario,M3H 5Y2,+1 416-514-1019,https://goldiesandwiches.com/,43.7696404,-79.4676451,4.8,231,"{'Friday': ['8a.m.-4p.m.'], 'Monday': ['8a.m.-4p.m.'], 'Saturday': ['Closed'], 'Sunday': ['Closed'], 'Thursday': ['8a.m.-4p.m.'], 'Tuesday': ['8a.m.-4p.m.'], 'Wednesday': ['8a.m.-4p.m.']}",ChIJXX3VIjgtK4gR6_5I-h8_Pv4,Caterer,"Caterer, Bagel shop, Breakfast restaurant, Brunch restaurant, Restaurant, Event venue, Health food restaurant, Lunch restaurant, Sandwich shop, Toast restaurant",restaurants,,kosher caterer North York
KACE Catering,"1230 Sheppard Ave W Unit 12, North York, ON M3K 1Z9",North York,Ontario,M3K 1Z9,+1 647-995-5414,https://www.kacecatering.com/,43.754767699999995,-79.4797932,4.8,17,"{'Friday': ['11a.m.-4p.m.'], 'Monday': ['11a.m.-4p.m.'], 'Saturday': ['Closed'], 'Sunday': ['Closed'], 'Thursday': ['11a.m.-4p.m.'], 'Tuesday': ['11a.m.-4p.m.'], 'Wednesday': ['11a.m.-4p.m.']}",ChIJR5qpCdoxK4gRW3XUSxQSg8M,Caterer,Caterer,Caterer,,kosher caterer North York
LeChaim Catering,"868 Magnetic Dr, North York, ON M3J 3M8",North York,Ontario,M3J 3M8,+1 416-650-5440,http://www.lechaimcatering.com/,43.7834928,-79.47837,3.5,11,"{'Friday': ['7a.m.-12p.m.'], 'Monday': ['7a.m.-7p.m.'], 'Saturday': ['Closed'], 'Sunday': ['Closed'], 'Thursday': ['7a.m.-7p.m.'], 'Tuesday': ['7a.m.-7p.m.'], 'Wednesday': ['7a.m.-7p.m.']}",ChIJFR8ReHQuK4gRo7USFva0S_0,Caterer,"Caterer, Food manufacturer, Mobile caterer",Caterer,,kosher caterer North York
Eisenbergs Restaurant & Caterer @ The SRC Centre,"9600 Bathurst Street, Maple, ON Maple, ON L6A 3Z8",Vaughan,ON,L6A 3Z8,+1 416-473-4689,https://www.eisenbergsandwiches.com/,43.8533818,-79.46222929999999,4.6,40,"{'Friday': ['8:30a.m.-2:30p.m.'], 'Monday': ['9a.m.-7:30p.m.'], 'Saturday': ['Closed'], 'Sunday': ['10a.m.-5p.m.'], 'Thursday': ['9a.m.-7:30p.m.'], 'Tuesday': ['9a.m.-7:30p.m.'], 'Wednesday': ['9a.m.-7:30p.m.']}",ChIJ_3ZJ5BYrK4gRVprytiv2LtY,Kosher restaurant,"Kosher restaurant, Cafe, Catering food and drink supplier, Caterer, Coffee shop, Event venue, Family restaurant, Food producer",restaurants,,kosher caterer Thornhill
Cafe Sheli,"7700 Bathurst St, Thornhill, ON L4J 0A7",Thornhill,Ontario,L4J 0A7,+1 905-762-0640,https://cafesheli.com/,43.8100849,-79.4521298,4.0,365,"{'Friday': ['Closed'], 'Monday': ['9a.m.-7:30p.m.'], 'Saturday': ['Closed'], 'Sunday': ['9:30a.m.-7:30p.m.'], 'Thursday': ['9a.m.-7:30p.m.'], 'Tuesday': ['9a.m.-7:30p.m.'], 'Wednesday': ['9a.m.-7:30p.m.']}",ChIJ78RKCjksK4gRuGE__kWjzFs,Kosher restaurant,"Kosher restaurant, Breakfast restaurant, Coffee store, Restaurant, Vegetarian restaurant",restaurants,"Spacious kosher eatery with outdoor seating serving breakfast & baked goods, plus lunch & dinner.",kosher caterer Thornhill
Elite Salads International,"77 Doncaster Ave, Thornhill, ON L3T 1L6",Thornhill,Ontario,L3T 1L6,+1 905-771-9356,http://www.elitesalads.com/,43.803923,-79.4152422,4.6,19,"{'Friday': ['7a.m.-3:30p.m.'], 'Monday': ['8:30a.m.-4p.m.'], 'Saturday': ['Closed'], 'Sunday': ['Closed'], 'Thursday': ['8a.m.-4p.m.'], 'Tuesday': ['8a.m.-4p.m.'], 'Wednesday': ['8a.m.-4p.m.']}",ChIJCYsPDPAsK4gRIXBS01biF2E,Caterer,"Caterer, Food producer, Kosher grocery store, Manufacturer",Caterer,,kosher caterer Thornhill
Jewish Caterer,"15 N Park Rd #1415, Vaughan, ON L4J 0A1",Vaughan,Ontario,L4J 0A1,+1 647-642-8643,http://jewishcaterer.com/,43.8125849,-79.4530841,5.0,2,"{'Friday': ['Open 24 hours'], 'Monday': ['Closed'], 'Saturday': ['12a.m.-7p.m.'], 'Sunday': ['Closed'], 'Thursday': ['Open 24 hours'], 'Tuesday': ['3a.m.-12a.m.'], 'Wednesday': ['Open 24 hours']}",ChIJX_Ygrz4sK4gR6F4gppvCQmg,Caterer,Caterer,Caterer,,kosher caterer Thornhill
Kapara,"7700 Bathurst St Unit 12, Thornhill, ON L4J 0A7",Thornhill,Ontario,L4J 0A7,+1 905-886-7444,https://kapara.ca/,43.8100041,-79.452213,4.8,207,"{'Friday': ['10a.m.-3p.m.'], 'Monday': ['12-10p.m.'], 'Saturday': ['7p.m.-12a.m.'], 'Sunday': ['12-10p.m.'], 'Thursday': ['12-10p.m.'], 'Tuesday': ['12-10p.m.'], 'Wednesday': ['12-10p.m.']}",ChIJ28xremEtK4gR1PnhMfPtXgY,Restaurant,Restaurant,restaurants,,kosher caterer Thornhill
Top Slice,"7241 Bathurst St, Thornhill, ON L4J 3W1",Thornhill,Ontario,L4J 3W1,+1 905-889-1400,http://www.topslice.ca/,43.7987952,-79.44642619999999,4.5,228,"{'Friday': ['11a.m.-2:30p.m.'], 'Monday': ['11a.m.-8p.m.'], 'Saturday': ['9p.m.-12a.m.'], 'Sunday': ['11a.m.-8:30p.m.'], 'Thursday': ['11a.m.-8:30p.m.'], 'Tuesday': ['11a.m.-8p.m.'], 'Wednesday': ['11a.m.-8p.m.']}",ChIJn3zfs0osK4gRA_ceDepuZ0s,Kosher restaurant,"Kosher restaurant, Pizza restaurant",restaurants,,kosher caterer Thornhill
Greg's Delights,"55 Glen Cameron Rd Unit 5, Thornhill, ON L3T 1P7",Thornhill,Ontario,L3T 1P7,+1 905-597-7734,https://gregsdelights.ca/,43.8059128,-79.4172141,4.3,11,"{'Friday': ['Closed'], 'Monday': ['7a.m.-2p.m.'], 'Saturday': ['Closed'], 'Sunday': ['Closed'], 'Thursday': ['7a.m.-2p.m.'], 'Tuesday': ['7a.m.-2p.m.'], 'Wednesday': ['7a.m.-2p.m.']}",ChIJXwgC5kotK4gRTqEYdZOF54E,Caterer,Caterer,Caterer,,kosher caterer Thornhill
Chic Pick Restaurant and Catering,"160 Cidermill Ave, Vaughan, ON L4K 4K5",Vaughan,Ontario,L4K 4K5,+1 416-897-8431,http://www.chicpickcatering.com/,43.8062271,-79.5337371,4.8,331,"{'Friday': ['11:30a.m.-9p.m.'], 'Monday': ['11:30a.m.-9p.m.'], 'Saturday': ['11:30a.m.-9p.m.'], 'Sunday': ['Closed'], 'Thursday': ['11:30a.m.-9p.m.'], 'Tuesday': ['11:30a.m.-9p.m.'], 'Wednesday': ['11:30a.m.-9p.m.']}",ChIJe6cMD5srK4gRoAN4IfFbFnA,Catering food and drink supplier,"Catering food and drink supplier, Restaurant",restaurants,"Laid-back eatery offering burgers, sandwiches & Persian-style plates for takeaway & delivery.",kosher caterer Vaughan
Arzo Catering - Hamida,"167 Applewood Crescent #3, Vaughan, ON L4K 4K7",Vaughan,Ontario,L4K 4K7,+1 647-525-9277,http://www.arzocatering.com/,43.8079673,-79.5341753,4.9,238,None,ChIJfVVksgsvK4gRNvEawmrvvCg,Caterer,Caterer,Caterer,,kosher caterer Vaughan
PRC Caterers,"240 Viceroy Rd, Concord, ON L4K 3N8",Concord,Ontario,L4K 3N8,+1 416-787-9889,https://prccaterers.com/,43.788759399999996,-79.4724404,5.0,10,"{'Friday': ['9a.m.-4p.m.'], 'Monday': ['9a.m.-5p.m.'], 'Saturday': ['Closed'], 'Sunday': ['Closed'], 'Thursday': ['9a.m.-5p.m.'], 'Tuesday': ['9a.m.-5p.m.'], 'Wednesday': ['9a.m.-5p.m.']}",ChIJcdCCpqAvK4gRCzxpVLF4XG0,Caterer,Caterer,Caterer,,kosher caterer Vaughan
Kosher Country Style,"72 Winters Rd, North York, ON M3J 2N9",CA,Ontario,M3J 2N9,+1 416-650-8260,,43.776261299999994,-79.5023994,4.5,24,"{'Friday': ['7a.m.-3p.m.'], 'Monday': ['7a.m.-7p.m.'], 'Saturday': ['Closed'], 'Sunday': ['Closed'], 'Thursday': ['7a.m.-7p.m.'], 'Tuesday': ['7a.m.-7p.m.'], 'Wednesday': ['7a.m.-7p.m.']}",ChIJf_43qDwuK4gRtzftuOBdfGU,Restaurant,Restaurant,restaurants,,kosher caterer Vaughan
Tov-Li,"5982 Bathurst St, North York, ON M2R 1Z1",North York,Ontario,M2R 1Z1,+1 416-650-9800,http://www.tovlipizza.com/,43.7842631,-79.4466951,4.3,714,"{'Friday': ['10a.m.-2p.m.'], 'Monday': ['10a.m.-8p.m.'], 'Saturday': ['Closed'], 'Sunday': ['10a.m.-8p.m.'], 'Thursday': ['10a.m.-8p.m.'], 'Tuesday': ['10a.m.-8p.m.'], 'Wednesday': ['10a.m.-8p.m.']}",ChIJxyCQ77gtK4gRe78r3ExqOsw,Caterer,"Caterer, Kosher restaurant, Falafel restaurant, Fast food restaurant, Pizza restaurant, Vegetarian restaurant",restaurants,"Low-key kosher restaurant serving falafel, salads, pasta & pizza plus all-day breakfast.",kosher caterer Bathurst Manor
Ba-Li Laffa,"7117 Bathurst St, Thornhill, ON L4J 2J6",Thornhill,Ontario,L4J 2J6,+1 905-597-7720,http://www.balilaffa.com/,43.7949866,-79.44573249999999,4.3,643,"{'Friday': ['11:30a.m.-2:30p.m.'], 'Monday': ['11:30a.m.-9:30p.m.'], 'Saturday': ['Closed'], 'Sunday': ['11:30a.m.-9:30p.m.'], 'Thursday': ['11:30a.m.-9:30p.m.'], 'Tuesday': ['11:30a.m.-9:30p.m.'], 'Wednesday': ['11:30a.m.-9:30p.m.']}",ChIJAaLEB7UtK4gR8lC3YuZgz9w,Kosher restaurant,Kosher restaurant,restaurants,"Mediterranean grill doling out kebabs, hummus & other familiar fare in a casual setting.",kosher caterer Bathurst Manor
Nortown Foods,"892 Eglinton Ave W, Toronto, ON M6C 2B6",Toronto,Ontario,M6C 2B6,+1 416-789-2921,http://www.nortownfoods.com/,43.700873699999995,-79.42722719999999,4.0,102.0,"{'Friday': ['8a.m.-7p.m.'], 'Monday': ['8a.m.-7p.m.'], 'Saturday': ['Closed'], 'Sunday': ['8a.m.-6p.m.'], 'Thursday': ['8a.m.-7p.m.'], 'Tuesday': ['8a.m.-7p.m.'], 'Wednesday': ['8a.m.-7p.m.']}",ChIJKflRSJ8zK4gR5dSnYTu6oPU,Supermarket,Supermarket,Supermarket,,kosher catering Forest Hill
Forest Hill Jewish Centre,"360 Spadina Rd, Toronto, ON M5P 2V4",Toronto,Ontario,M5P 2V4,+1 416-483-0883,https://www.foresthilljewishcentre.org/,43.686080499999996,-79.41195499999999,4.6,59.0,"{'Friday': ['Open 24 hours'], 'Monday': ['Open 24 hours'], 'Saturday': ['Open 24 hours'], 'Sunday': ['Open 24 hours'], 'Thursday': ['Open 24 hours'], 'Tuesday': ['Open 24 hours'], 'Wednesday': ['Open 24 hours']}",ChIJYwrSk2QzK4gRFHv67dnCZy8,Synagogue,"Synagogue, Community center, Orthodox synagogue",Synagogue,,kosher catering Forest Hill
Kosher Catering Ltd,"Pape Ave, East York, ON M4J 2S5",CA,Ontario,M4J 2S5,+1 416-477-2518,http://koshergrouptrips.com/,43.6930117,-79.350161,,,"{'Friday': ['Open 24 hours'], 'Monday': ['Open 24 hours'], 'Saturday': ['Open 24 hours'], 'Sunday': ['Open 24 hours'], 'Thursday': ['Open 24 hours'], 'Tuesday': ['Open 24 hours'], 'Wednesday': ['Open 24 hours']}",ChIJ__-_lQvN1IkRrs9Hy-N8Pv8,Caterer,"Caterer, Catering food and drink supplier",Caterer,,kosher catering Forest Hill
Yoona's Kitchen *Keto & Sugar Free & Gluten Free & Diabetic Friendly & Grain Free* Dairy Free & Vegan Option,"3895 Bathurst St, Toronto, ON M3H 5V1",Toronto,Ontario,M3H 5V1,+1 647-343-8200,http://www.yoona.ca/,43.7425011,-79.4348517,4.9,178.0,"{'Friday': ['11a.m.-6p.m.'], 'Monday': ['Closed'], 'Saturday': ['11a.m.-6p.m.'], 'Sunday': ['Closed'], 'Thursday': ['11a.m.-6p.m.'], 'Tuesday': ['11a.m.-6p.m.'], 'Wednesday': ['11a.m.-6p.m.']}",ChIJJdu63PwzK4gRss1EF-3zo1g,Bakery,"Bakery, Diabetes center, Gluten-free restaurant, Weight loss service",Bakery,,kosher catering Forest Hill
Summerhill Market - Forest Hill,"484 Eglinton Ave W, Toronto, ON M5N 1A5",Toronto,Ontario,M5N 1A5,+1 416-941-2574,http://www.summerhillmarket.com/,43.7038407,-79.4128175,4.3,215.0,"{'Friday': ['8a.m.-8p.m.'], 'Monday': ['8a.m.-8p.m.'], 'Saturday': ['8a.m.-8p.m.'], 'Sunday': ['8a.m.-8p.m.'], 'Thursday': ['8a.m.-8p.m.'], 'Tuesday': ['8a.m.-8p.m.'], 'Wednesday': ['8a.m.-8p.m.']}",ChIJWRnpGBIzK4gR2Z0YwE6mWio,Grocery store,Grocery store,Grocery store,,kosher catering Forest Hill
Jerusalem Restaurant,"955 Eglinton Ave W, York, ON M6C 2C4",York,Ontario,M6C 2C4,+1 416-783-6494,http://www.jerusalemrestaurant.ca/,43.7000323,-79.4290223,4.3,1159.0,"{'Friday': ['11:30a.m.-8p.m.'], 'Monday': ['11:30a.m.-8p.m.'], 'Saturday': ['11:30a.m.-8p.m.'], 'Sunday': ['11:30a.m.-7:30p.m.'], 'Thursday': ['11:30a.m.-8p.m.'], 'Tuesday': ['11:30a.m.-8p.m.'], 'Wednesday': ['11:30a.m.-8p.m.']}",ChIJjRtsbp8zK4gR7Kspt4XygD4,Middle Eastern restaurant,"Middle Eastern restaurant, Mediterranean restaurant, Restaurant",restaurants,Family-owned dining room with Middle Eastern food in a low-key space with take-out options.,kosher catering Forest Hill
Aba's Bagel Company,"884a Eglinton Ave W, Toronto, ON M6C 2B6",Toronto,Ontario,M6C 2B6,+1 416-780-2020,https://abasbagel.com/,43.7009263,-79.42702039999999,4.3,159.0,"{'Friday': ['7a.m.-5p.m.'], 'Monday': ['7a.m.-4p.m.'], 'Saturday': ['7a.m.-3p.m.'], 'Sunday': ['7a.m.-3p.m.'], 'Thursday': ['7a.m.-4p.m.'], 'Tuesday': ['7a.m.-4p.m.'], 'Wednesday': ['7a.m.-4p.m.']}",ChIJVZ_j1D4zK4gRkYZw0B6_QrA,Bagel shop,Bagel shop,Bagel shop,"Bagel bakery serving the house specialty, plus breakfasts & sandwiches, morning to mid-afternoon.",kosher catering Forest Hill
Ace Kosher Inc,"9600 Bathurst St, Maple, ON L6A 3Z8",Maple,Ontario,L6A 3Z8,,http://www.acekosher.com/,43.8533171,-79.4621264,5.0,3.0,"{'Friday': ['9a.m.-5p.m.'], 'Monday': ['9a.m.-5p.m.'], 'Saturday': ['Closed'], 'Sunday': ['Closed'], 'Thursday': ['9a.m.-5p.m.'], 'Tuesday': ['9a.m.-5p.m.'], 'Wednesday': ['9a.m.-5p.m.']}",ChIJ0XzJ7MYzK4gRKui09mD1Z-U,Caterer,Caterer,Caterer,,kosher catering Forest Hill
What A Bagel Spadina Road,"421 Spadina Rd, Toronto, ON M5P 2W3",Toronto,Ontario,M5P 2W3,+1 416-480-9358,http://www.whatabagel.com/,43.6888942,-79.4126065,4.1,432.0,"{'Friday': ['6a.m.-6p.m.'], 'Monday': ['6a.m.-6p.m.'], 'Saturday': ['6a.m.-6p.m.'], 'Sunday': ['6a.m.-6p.m.'], 'Thursday': ['6a.m.-6p.m.'], 'Tuesday': ['6a.m.-6p.m.'], 'Wednesday': ['6a.m.-6p.m.']}",ChIJl1JgamUzK4gR982r3JJbHjo,Restaurant,"Restaurant, Bagel shop, Bakery",Bakery,"Bagel bakery serving the house specialty, plus breakfasts & sandwiches, morning to mid-afternoon.",kosher catering Forest Hill
Crema Cafe,"3032 Bathurst St, Toronto, ON M6B 3B6",Toronto,Ontario,M6B 3B6,+1 416-780-1110,https://cremacafeto.com/,43.718258899999995,-79.42974099999999,4.5,95,"{'Friday': ['8a.m.-3p.m.'], 'Monday': ['8a.m.-5p.m.'], 'Saturday': ['7p.m.-12a.m.'], 'Sunday': ['9a.m.-4p.m.'], 'Thursday': ['8a.m.-5p.m.'], 'Tuesday': ['8a.m.-5p.m.'], 'Wednesday': ['8a.m.-5p.m.']}",ChIJ4zRMAfAzK4gR92-U_hIgXA0,Cafe,Cafe,cafes,,kosher catering Lawrence Park
David Mintz Catering,"28 Vansco Rd, Etobicoke, ON M8Z 5J4",Etobicoke,Ontario,M8Z 5J4,+1 647-837-3348,https://dmcatering.ca/,43.622225,-79.5357136,4.5,80,"{'Friday': ['7a.m.-6p.m.'], 'Monday': ['7a.m.-6p.m.'], 'Saturday': ['7a.m.-6p.m.'], 'Sunday': ['7a.m.-6p.m.'], 'Thursday': ['7a.m.-6p.m.'], 'Tuesday': ['7a.m.-6p.m.'], 'Wednesday': ['7a.m.-6p.m.']}",ChIJg9YlmA7L1IkRCbn9G6co4Uw,Caterer,Caterer,Caterer,,best kosher caterer Toronto
Noah Kosher Sushi,"4119 Bathurst St, North York, ON M3H 3P4",North York,Ontario,M3H 3P4,+1 647-343-4773,http://www.noahkoshersushi.ca/,43.747022099999995,-79.4359655,4.7,57,"{'Friday': ['7a.m.-2:30p.m.'], 'Monday': ['9a.m.-7p.m.'], 'Saturday': ['Closed'], 'Sunday': ['9a.m.-6p.m.'], 'Thursday': ['9a.m.-7p.m.'], 'Tuesday': ['9a.m.-7p.m.'], 'Wednesday': ['9a.m.-7p.m.']}",ChIJ-dEQemUyK4gR3OhXhSXpRjI,Takeout Restaurant,"Takeout Restaurant, Japanese restaurant, Sushi restaurant",restaurants,,best kosher restaurant Toronto
Wok & Bowl,"3022 Bathurst St, North York, ON M6B 3B6",CA,Ontario,M6B 3B6,+1 416-435-5678,http://www.wokandbowl.ca/,43.7180353,-79.42967039999999,4.0,92,"{'Friday': ['9:30a.m.-2:30p.m.'], 'Monday': ['11a.m.-9p.m.'], 'Saturday': ['Closed'], 'Sunday': ['11a.m.-10p.m.'], 'Thursday': ['11a.m.-9p.m.'], 'Tuesday': ['11a.m.-9p.m.'], 'Wednesday': ['11a.m.-9p.m.']}",ChIJ6fSgv_4zK4gRVPdvmOVRVhA,Restaurant,Restaurant,restaurants,,best kosher restaurant Toronto
